mysql> select * from salesman;
+-------------+----------+--------+------------+
| salesman_id | name     | city   | commission |
+-------------+----------+--------+------------+
|           1 | rajendra | blore  |         10 |
|           2 | shravan  | mumbai |         20 |
|           3 | pradhaan | delhi  |          5 |
|           4 | karthik  | hyd    |          5 |
+-------------+----------+--------+------------+
4 rows in set (0.00 sec)

select * from customer;
+---------+----------+--------+-------+-------------+
| cust_id | name     | city   | grade | salesman_id |
+---------+----------+--------+-------+-------------+
|     101 | nayana   | blore  |   200 |           1 |
|     102 | abhilash | mumbai |   100 |           2 |
|     103 | deepak   | blore  |   400 |           1 |
|     104 | gaurav   | delhi  |   300 |           3 |
+---------+----------+--------+-------+-------------+
4 rows in set (0.00 sec)

mysql> select * from orders;
+--------+--------+------------+---------+-------------+
| ord_no | amount | date       | cust_id | salesman_id |
+--------+--------+------------+---------+-------------+
|    201 |   2001 | 2023-11-24 |     101 |           1 |
|    202 |   5001 | 2023-01-24 |     102 |           1 |
|    203 |   8001 | 2023-03-24 |     103 |           2 |
+--------+--------+------------+---------+-------------+
3 rows in set (0.00 sec)



3. List all salesmen and indicate those who have and don’t have customers in their cities (Use UNION operation.)
select salesman.salesman_id ,salesman.name,customer.name,commission from salesman,customer
    -> where salesman.city=customer.city
    -> union
    -> select salesman_id,name,"no match",commission from salesman
    -> where not city=any (select city from customer) order by 2 desc;
+-------------+----------+----------+------------+
| salesman_id | name     | name     | commission |
+-------------+----------+----------+------------+
|           2 | shravan  | abhilash |         20 |
|           1 | rajendra | nayana   |         10 |
|           1 | rajendra | deepak   |         10 |
|           3 | pradhaan | gaurav   |          5 |
|           4 | karthik  | no match |          5 |
+-------------+----------+----------+------------+
5 rows in set (0.00 sec)

4. Create a view that finds the salesman who has the customer with the highest order of a day.
    -> create view elitesalesman as 
    -> select b.date,a.salesman_id,a.name from salesman a,orders b
    -> where a.salesman_id=b.salesman_id
    -> and b.amount=(select max(amount) from orders c
    -> where c.date=b.date);
  Query OK, 0 rows affected (0.53 sec)
  
  select * from elitesalesman;
  +------------+-------------+----------+
  | date       | salesman_id | name     |
  +------------+-------------+----------+
  | 2023-11-24 |           1 | rajendra |
  | 2023-01-24 |           1 | rajendra |
  | 2023-03-24 |           2 | shravan  |
  +------------+-------------+----------+
  3 rows in set (0.03 sec)


5.Demonstrate the DELETE operation by removing salesman with id 1000. All his orders must also be deleted.

delete from salesman where salesman_id=3;
Query OK, 1 row affected (0.10 sec)

mysql> select * from salesman;
+-------------+----------+--------+------------+
| salesman_id | name     | city   | commission |
+-------------+----------+--------+------------+
|           1 | rajendra | blore  |         10 |
|           2 | shravan  | mumbai |         20 |
|           4 | karthik  | hyd    |          5 |
+-------------+----------+--------+------------+
3 rows in set (0.00 sec)

mysql> select * from customer;
+---------+----------+--------+-------+-------------+
| cust_id | name     | city   | grade | salesman_id |
+---------+----------+--------+-------+-------------+
|     101 | nayana   | blore  |   200 |           1 |
|     102 | abhilash | mumbai |   100 |           2 |
|     103 | deepak   | blore  |   400 |           1 |
+---------+----------+--------+-------+-------------+
3 rows in set (0.00 sec)
//cust_id 104 matching with salesman_id 3 has also been deleted;
mysql> select * from orders;
+--------+--------+------------+---------+-------------+
| ord_no | amount | date       | cust_id | salesman_id |
+--------+--------+------------+---------+-------------+
|    201 |   2001 | 2023-11-24 |     101 |           1 |
|    202 |   5001 | 2023-01-24 |     102 |           1 |
|    203 |   8001 | 2023-03-24 |     103 |           2 |
+--------+--------+------------+---------+-------------+
3 rows in set (0.00 sec)

